{
  "city_id": "TBD_US_CITY",
  "city_name": "Synthetic US Wildland-Urban Interface",
  "timezone": "UTC",
  "native_crs": "EPSG:4326",
  "model_grid_m": 500,
  "forecast_horizons_minutes": [30, 60, 120],
  "advisory_only": true,
  "data_mode": "synthetic-demo",
  "decision_thresholds": {
    "evacuation_p90": 0.55,
    "resource_stage_p50": 0.35,
    "critical_facility_multiplier": 1.5
  },
  "cells": [
    {"id": "A1", "row": 0, "col": 0, "fuel": 0.70, "slope": 0.20, "population": 120, "critical_facilities": 0},
    {"id": "A2", "row": 0, "col": 1, "fuel": 0.80, "slope": 0.35, "population": 310, "critical_facilities": 1},
    {"id": "A3", "row": 0, "col": 2, "fuel": 0.65, "slope": 0.25, "population": 420, "critical_facilities": 0},
    {"id": "B1", "row": 1, "col": 0, "fuel": 0.85, "slope": 0.45, "population": 90, "critical_facilities": 0},
    {"id": "B2", "row": 1, "col": 1, "fuel": 0.90, "slope": 0.50, "population": 250, "critical_facilities": 0},
    {"id": "B3", "row": 1, "col": 2, "fuel": 0.75, "slope": 0.30, "population": 560, "critical_facilities": 1},
    {"id": "C1", "row": 2, "col": 0, "fuel": 0.60, "slope": 0.15, "population": 80, "critical_facilities": 0},
    {"id": "C2", "row": 2, "col": 1, "fuel": 0.72, "slope": 0.25, "population": 600, "critical_facilities": 1},
    {"id": "C3", "row": 2, "col": 2, "fuel": 0.55, "slope": 0.10, "population": 780, "critical_facilities": 1}
  ]
}

